[
  {
    "id": "emoticon",
    "name": "The Emoticon :-)",
    "year": 1982,
    "era": "dawn",
    "glyph": ":-)",
    "summary": "A sideways smiling face made of punctuation, invented so people could tell when a message was meant as a joke.",
    "quote": ":-)",
    "origin": {
      "platform": "Carnegie Mellon bulletin board",
      "creator": "Scott Fahlman",
      "story": "On 19 September 1982 Fahlman suggested typing :-) to mark jokes and :-( for serious posts, after a joke on the board was taken seriously."
    },
    "legacy": "Every emoji descends from it.",
    "status": "evergreen",
    "tags": [
      "text",
      "origins"
    ],
    "sources": [
      {
        "title": "Wikipedia",
        "url": "https://en.wikipedia.org/wiki/Emoticon"
      }
    ],
    "provenance": {
      "by": "seed",
      "verified": false
    }
  },
  {
    "id": "godwins-law",
    "name": "Godwin's Law",
    "year": 1990,
    "era": "dawn",
    "glyph": "§",
    "summary": "As an online discussion grows longer, the chance that someone compares someone else to Hitler approaches one.",
    "quote": "Probability approaches 1.",
    "origin": {
      "platform": "Usenet",
      "creator": "Mike Godwin",
      "story": "Godwin put forward the 'law' in 1990 as a way to point out how quickly Usenet arguments escalated."
    },
    "legacy": "One of the first laws of online behavior, still quoted in comment sections.",
    "status": "evergreen",
    "tags": [
      "usenet",
      "argument"
    ],
    "sources": [
      {
        "title": "Wikipedia",
        "url": "https://en.wikipedia.org/wiki/Godwin%27s_law"
      }
    ],
    "provenance": {
      "by": "seed",
      "verified": false
    }
  },
  {
    "id": "spam",
    "name": "Spam",
    "year": 1994,
    "era": "dawn",
    "glyph": "🥫",
    "summary": "Unwanted bulk messages, named after a sketch about a café where every dish includes Spam.",
    "quote": "Spam, spam, spam, spam...",
    "origin": {
      "platform": "Usenet & email",
      "story": "Named after a Monty Python sketch where a chorus drowns out everything with 'Spam'. MUD users used the word for flooding first, and a 1994 Usenet ad posted to thousands of groups made it famous."
    },
    "legacy": "The joke became the technical term.",
    "status": "evergreen",
    "tags": [
      "email",
      "language"
    ],
    "sources": [
      {
        "title": "Wikipedia",
        "url": "https://en.wikipedia.org/wiki/Spamming"
      }
    ],
    "links": [
      {
        "to": "good-times-hoax",
        "why": "Unwanted mail, two ways."
      }
    ],
    "provenance": {
      "by": "seed",
      "verified": false
    }
  },
  {
    "id": "good-times-hoax",
    "name": "The Good Times Virus",
    "year": 1994,
    "era": "dawn",
    "glyph": "✉",
    "summary": "A fake virus warning that copied itself better than any real virus, because people kept forwarding it.",
    "quote": "FORWARD THIS TO EVERYONE YOU KNOW",
    "origin": {
      "platform": "Email",
      "story": "In late 1994 warnings spread by email that opening a message titled 'Good Times' would wipe your hard drive. The virus never existed. The warning was the thing that spread."
    },
    "legacy": "The ancestor of every chain message.",
    "status": "classic",
    "tags": [
      "email",
      "hoax"
    ],
    "sources": [
      {
        "title": "Wikipedia",
        "url": "https://en.wikipedia.org/wiki/Good_Times_virus"
      }
    ],
    "provenance": {
      "by": "seed",
      "verified": false
    }
  },
  {
    "id": "dancing-baby",
    "name": "The Dancing Baby",
    "year": 1996,
    "era": "dawn",
    "glyph": "👶",
    "summary": "A rendered 3D baby doing a cha-cha, and probably the first viral video.",
    "quote": "Ooga-chaka",
    "origin": {
      "platform": "Email attachments",
      "creator": "Michael Girard & Robert Lurye",
      "story": "A 3D sample animation made for Autodesk Character Studio got passed around as a file attachment, then shown on Ally McBeal in 1998."
    },
    "legacy": "Showed that a looping animation could travel the world on its own.",
    "status": "classic",
    "tags": [
      "animation",
      "3d"
    ],
    "sources": [
      {
        "title": "Wikipedia",
        "url": "https://en.wikipedia.org/wiki/Dancing_baby"
      }
    ],
    "provenance": {
      "by": "seed",
      "verified": false
    }
  },
  {
    "id": "hampster-dance",
    "name": "The Hampster Dance",
    "year": 1998,
    "era": "flash",
    "glyph": "🐹",
    "summary": "A web page that was nothing but dancing hamster GIFs and a squeaky song. Millions of people visited.",
    "quote": "Dee da da da dum",
    "origin": {
      "platform": "GeoCities",
      "creator": "Deidre LaCarte",
      "story": "A homepage covered in rows of animated hamster GIFs, played over a sped-up sample from Disney's Robin Hood (1973)."
    },
    "legacy": "The original attention economy, built from four GIFs.",
    "status": "classic",
    "tags": [
      "geocities",
      "gif",
      "music"
    ],
    "sources": [
      {
        "title": "Wikipedia",
        "url": "https://en.wikipedia.org/wiki/Hampster_Dance"
      }
    ],
    "provenance": {
      "by": "seed",
      "verified": false
    }
  },
  {
    "id": "mahir",
    "name": "I KISS YOU!!!",
    "year": 1999,
    "era": "flash",
    "glyph": "💋",
    "summary": "A sincere personal homepage that the whole internet came to visit.",
    "quote": "WELCOME TO MY HOMEPAGE!!!!!!!!! I KISS YOU!!!!!",
    "origin": {
      "platform": "Personal homepage",
      "creator": "Mahir Çağrı",
      "story": "A Turkish journalist's earnest homepage, with its broken-English greeting and invitations to visit, was linked everywhere."
    },
    "legacy": "An early lesson in going viral without meaning to.",
    "status": "classic",
    "tags": [
      "homepage",
      "sincerity"
    ],
    "sources": [
      {
        "title": "Wikipedia",
        "url": "https://en.wikipedia.org/wiki/Mahir_%C3%87a%C4%9Fr%C4%B1"
      }
    ],
    "provenance": {
      "by": "seed",
      "verified": false
    }
  },
  {
    "id": "all-your-base",
    "name": "All Your Base Are Belong to Us",
    "year": 2001,
    "era": "flash",
    "glyph": "👾",
    "summary": "A mistranslated villain's line from a 1989 shoot-'em-up that turned into the web's catchphrase.",
    "quote": "ALL YOUR BASE ARE BELONG TO US",
    "origin": {
      "platform": "Something Awful & Newgrounds",
      "story": "A badly translated cutscene from the 1991 European release of Zero Wing got passed around forums, then became a 2001 Flash video set to a techno track."
    },
    "legacy": "Engrish turned into a way of belonging.",
    "status": "classic",
    "tags": [
      "games",
      "engrish",
      "flash"
    ],
    "sources": [
      {
        "title": "Wikipedia",
        "url": "https://en.wikipedia.org/wiki/All_your_base_are_belong_to_us"
      }
    ],
    "links": [
      {
        "to": "skibidi-toilet",
        "why": "Nonsense lore that a generation took completely seriously."
      }
    ],
    "provenance": {
      "by": "seed",
      "verified": false
    }
  },
  {
    "id": "pbj-time",
    "name": "Peanut Butter Jelly Time",
    "year": 2002,
    "era": "flash",
    "glyph": "🍌",
    "summary": "A dancing banana. That's the whole thing.",
    "quote": "It's peanut butter jelly time!",
    "origin": {
      "platform": "Flash animation",
      "story": "A pixelated banana dances to the Buckwheat Boyz song in a loop."
    },
    "legacy": "Hall of fame for nonsense loops.",
    "status": "classic",
    "tags": [
      "flash",
      "music",
      "loop"
    ],
    "sources": [
      {
        "title": "Wikipedia",
        "url": "https://en.wikipedia.org/wiki/Peanut_Butter_Jelly_Time"
      }
    ],
    "provenance": {
      "by": "seed",
      "verified": false
    }
  },
  {
    "id": "badger-badger",
    "name": "Badger Badger Badger",
    "year": 2003,
    "era": "flash",
    "glyph": "🦡",
    "summary": "An endless chant of badgers, mushrooms and one snake.",
    "quote": "Mushroom, mushroom!",
    "origin": {
      "platform": "weebls-stuff.com",
      "creator": "Jonti Picking",
      "story": "A hypnotic Flash loop of badgers doing calisthenics, broken up by a mushroom and a snake."
    },
    "legacy": "The peak of Flash-era repetition.",
    "status": "classic",
    "tags": [
      "flash",
      "loop",
      "animals"
    ],
    "sources": [
      {
        "title": "Wikipedia",
        "url": "https://en.wikipedia.org/wiki/Badger_Badger_Badger"
      }
    ],
    "provenance": {
      "by": "seed",
      "verified": false
    }
  },
  {
    "id": "star-wars-kid",
    "name": "Star Wars Kid",
    "year": 2003,
    "era": "flash",
    "glyph": "⚔",
    "summary": "One of the first viral videos, and one of the first public conversations about cyberbullying.",
    "quote": "(lightsaber noises)",
    "origin": {
      "platform": "Shared video file",
      "story": "Classmates uploaded a teenager's private video of himself swinging a golf ball retriever like a lightsaber, without his consent."
    },
    "legacy": "A reminder that there's a real person on the other side.",
    "status": "classic",
    "tags": [
      "video",
      "consent"
    ],
    "sources": [
      {
        "title": "Wikipedia",
        "url": "https://en.wikipedia.org/wiki/Star_Wars_Kid"
      }
    ],
    "links": [
      {
        "to": "charlie-bit-my-finger",
        "why": "Home video that escaped the home."
      }
    ],
    "provenance": {
      "by": "seed",
      "verified": false
    }
  },
  {
    "id": "numa-numa",
    "name": "Numa Numa",
    "year": 2004,
    "era": "flash",
    "glyph": "🎧",
    "summary": "A man in headphones lip-syncing a Moldovan pop song with his whole heart.",
    "quote": "Ma-ia-hii, ma-ia-huu",
    "origin": {
      "platform": "Newgrounds",
      "creator": "Gary Brolsma",